{
  "activation_required": true,
  "contract_version": "leos.administrator-bootstrap.v1",
  "created_at": "2026-07-20T00:00:00+00:00",
  "credential_mode": "deferred-activation",
  "credential_reference": "operator-activation:admin",
  "display_name": "LEOS Administrator",
  "email": "admin@example.invalid",
  "plaintext_secret_persisted": false,
  "role": "administrator",
  "session_id": "first-run-7a0168a004401f40",
  "username": "admin"
}
